{
  "id": "aud_20260222_0001",
  "run_id": "run_weekly_ops_sync_20260222",
  "event_type": "approval.resolved",
  "actor": {
    "type": "user",
    "id": "usr_yingapple"
  },
  "payload_hash": "sha256:4f91532d8709d66b2f5c76d2b4201b4a0f923f2f7e7f6a0a8b4223701ed5ef4f",
  "decision_ref": "pol_approve_send_summary",
  "occurred_at": "2026-02-22T12:31:20Z"
}
